{
  "date": "2026-07-21",
  "report_time": "2026-07-22T09:22:00+08:00",
  "report_note": "2026-07-22 追补三轮：09:18补Ivanhoe Mines Kamoa X信号（Python 3.13修复playwright）；09:22按用户要求补入Alkane Resources FY26年报、巴西7月铜矿出口骤降、智利风暴第4天更新（7月21日造成人员死亡为新事实）。",
  "windows": {
    "part1": {
      "start": "2026-07-19T00:00:00+08:00",
      "end": "2026-07-21T23:59:59+08:00"
    },
    "part2": {
      "start": "2026-07-21T00:00:00+08:00",
      "end": "2026-07-21T23:59:59+08:00"
    },
    "part3": {
      "start": "2026-07-21T00:00:00+08:00",
      "end": "2026-07-21T23:59:59+08:00"
    }
  },
  "summary": "7月21日铜供需密集：供给端Las Bambas Q2品位降至0.86%（-5% YoY）vs Ivanhoe Kamoa采矿率升30%至70万吨/月——一紧一松鲜明对照；巴西7月铜矿出口日均-55.56%骤降（H1曾+84%）；智利冬季风暴进入第4天已致多人死亡，中部矿山港口持续受限。黄金方面Alkane Resources FY26金当量产量168,337oz（指引上沿）首次派息。银副产品收益推动MMG和Alkane成本显著改善。",
  "part1_broadcasts": [],
  "part2_x_posts": [
    {
      "author": "Ivanhoe Mines",
      "handle": "IvanhoeMines_",
      "publish_time": "2026-07-21T23:40:21+08:00",
      "metal_tags": ["copper"],
      "primary_metal": "copper",
      "supply_demand": "supply",
      "excerpt": "7月21日，Ivanhoe Mines通过官方X账号宣布：Kamoa铜矿两座新箱型堑沟（box cuts）正在解锁下一阶段产能。H2 2026全矿采矿率计划提升30%至70万吨/月，新增采矿班组、启动空场采矿法（stoping），并通过Kahala箱型堑沟新增出矿通道。Kansoko Sud箱型堑沟建设已完成，剩余700米斜坡道掘进预计2027年Q1抵达矿体。",
      "interpretation": "Kamoa-Kakula是全球第三大铜矿（2026年产量指引42-46万吨铜），采矿率从当前约54万吨/月提升30%至70万吨/月是重大的供给端增量信号。这一扩产路径区别于选矿厂产能扩张——它是通过增加采矿工作面（新box cuts）和采矿方法升级（从掘进向空场采矿法过渡）来释放矿山固有的采选产能。在当前全球铜精矿TC深度负值（-146美元/干吨）、主要矿山普遍面临品位下降和运营困扰的背景下，Kamoa作为全球成本最低的大型铜矿之一，其扩产是供给侧为数不多的确定性增量。",
      "importance": "Kamoa-Kakula年产铜42-46万吨（2026指引），占全球铜矿产量的约2%。从54万吨/月提升至70万吨/月意味着年化矿石处理量有望从~650万吨增至~840万吨，若品位和回收率稳定，对应年铜产量增量约6-10万吨——这在TC-146美元、全球铜矿库存降至多年来低位的极度紧缺市场中，是供给侧的一项重大积极信号。",
      "url": "https://x.com/IvanhoeMines_/status/2079592323617562838",
      "source_channel": "browser_use"
    }
  ],
  "part3_news": [
    {
      "source": "MMG Limited (HKEX: 01208) / 智通财经",
      "title": "五矿资源Q2 2026产量报告：Las Bambas铜产量109,192吨同比-5%（品位0.86%），全线C1成本指引显著下修，银产量+13%创副产品收益亮点",
      "url": "https://www.zhitongcaijing.com/content/detail/1470363.html",
      "publish_time": "2026-07-21",
      "metal_tags": ["copper", "gold", "silver"],
      "primary_metal": "copper",
      "supply_demand": "supply",
      "excerpt": "7月21日，五矿资源（01208.HK）发布2026年第二季度生产报告。Q2铜总产量137,843吨，与去年同期基本持平。Las Bambas铜精矿含铜109,192吨同比-5%（入选品位0.86%，选冶回收率89.8%）；Kinsevere电解铜16,980吨同比+24%（硫化矿爬坡）；Khoemacau铜精矿含铜11,423吨持平。副产品：金28,119盎司同比-9%，银2,825,891盎司同比+13%。C1成本指引全线显著下修：Las Bambas从$1.20-1.40/lb降至$0.85-1.05/lb，Khoemacau从$2.00-2.30/lb降至$1.70-2.00/lb，Rosebery从-$0.60至-$0.10/lb降至-$1.50至-$1.00/lb（负值表示贵金属副产品收益超过运营成本）。五座矿山均符合全年指引。",
      "interpretation": "MMG Q2产量报告提供了大型中资控股铜矿企业的最新供给侧快照。Las Bambas品位0.86%处于历史偏低位，短期瓶颈在品位而非处理能力。C1成本指引大幅下修是本次最突出信号——受益于贵金属副产品（尤其白银+13%）和成本优化。Kinsevere硫化矿爬坡+24%验证了刚果（金）增长逻辑。Rosebery的C1成本已为负数（贵金属收益完全覆盖锌生产成本），凸显银副产品在当前银价环境下的战略价值。",
      "importance": "MMG是全球前15大铜生产商之一（年铜产量约55万吨），Las Bambas（秘鲁）占全球铜矿产量约1.8%。C1成本指引下修幅度（-29%至-15%）超出市场预期。",
      "language": "zh",
      "duplicate_of": null
    },
    {
      "source": "Alkane Resources (ASX: ALK) / Mining Weekly",
      "title": "Alkane Resources FY26金当量产量168,337盎司（指引上沿），创纪录现金流A$5.66亿，首次派发股息2澳分/股",
      "url": "https://www.miningweekly.com/article/alkane-declares-maiden-002-full-year-dividend-after-strong-production-cashflow-generation-2026-07-21",
      "publish_time": "2026-07-21",
      "metal_tags": ["gold", "silver"],
      "primary_metal": "gold",
      "supply_demand": "supply",
      "excerpt": "7月21日，ASX及TSX上市的金锑生产商Alkane Resources发布FY2026（截至2026年6月30日）全年及Q4季报。FY26金当量产量168,337盎司（AuEq oz），处于指引区间160,000-175,000oz的上半部，AISC A$2,925/oz。Q4产量42,491 AuEq oz（含金40,949oz、锑456吨），AISC A$3,011/oz（品位计划性波动导致环比成本略升）。全年矿场运营现金流A$5.66亿，年末现金+金条+上市投资合计A$4.54亿（季度净增A$1.04亿）。Q4实现金价A$5,442/oz、锑价A$24,276/吨。董事会提议首次派发全额免税股息2澳分/股（待审计和董事会最终批准）。三座运营矿山：Tomingley（新南威尔士，Q4金20,896oz）、Costerfield（维多利亚，金锑，Q4 AuEq 11,659oz）、Björkdal（瑞典，Q4金9,935oz）。FY27产量指引163,000-177,000 AuEq oz，AISC A$2,900-3,200/oz，增长资本开支至少A$1.6亿。",
      "interpretation": "Alkane FY26年报是中型金矿企业运营健康度的正面信号。产量达指引上沿（168,337oz vs 160-175k指引）验证了三矿山运营模式的稳定性。首次派息标志着公司从纯增长阶段进入股东回报阶段，A$4.54亿现金储备（零负债除A$1,700万设备融资）提供了极强的资产负债表支撑。澳大利亚金矿商在当前A$5,400+/oz的实现金价下享有极高利润率（AISC仅A$2,925/oz，利润率约45%）。FY27产量指引维持稳定（163-177k oz），成本略有上升（AISC中位数A$3,050/oz vs FY26的A$2,925），反映通胀压力和品位正常化。增长项目（Newell Highway改道、Brunswick South开发、Storheden启动）在A$1.6亿+资本开支框架下为中期产量增长提供可见性。",
      "importance": "Alkane是澳大利亚前10大金矿生产商之一，三座矿山分布在澳大利亚和瑞典，年产金约16-17万盎司。首次派息+创纪录现金流是金矿行业盈利能力的有力证明——在当前金价$4,000/oz环境下，成本控制优秀的矿商仍能产生可观自由现金流。这一信号与其他金矿商Q2报告（MMG金-9%）形成对比，说明资产质量和成本控制正在分化金矿商的表现。",
      "language": "en",
      "duplicate_of": null
    },
    {
      "source": "新华财经 / 巴西对外贸易秘书处 (Secex) / 北方有色网",
      "title": "巴西7月前三周铜矿出口骤降：日均装运量3,500吨同比-55.56%，与H1出口+84%形成急剧反转",
      "url": "https://cmcc.china-mcc.com/news_show-96-10729.html",
      "publish_time": "2026-07-21",
      "metal_tags": ["copper"],
      "primary_metal": "copper",
      "supply_demand": "supply",
      "excerpt": "7月21日，新华财经援引巴西对外贸易秘书处（Secex）数据：2026年7月截至第3周（13个工作日），巴西累计装出铜矿石和铜精矿4.52万吨。去年7月全月为17.99万吨。日均装运量0.35万吨/日，较去年7月的0.78万吨/日减少55.56%。对比H1 2026巴西铜矿出口量同比+30.1%至84.85万吨、出口金额+84%至$38.7亿——上半年中国、德国和印度需求强劲推动巴西铜矿出口创纪录增长，但7月出现急剧减速。",
      "interpretation": "巴西7月铜矿出口日均-55.56%的数据点值得关注，因为与H1 2026的强劲表现（+84%金额、+30%量）形成急剧反差。可能原因包括：(1)季节性因素——7月为南半球冬季，部分矿区可能因天气或计划检修减产；(2)发货节奏——月度数据受单船发货时间影响较大，前三周数据可能无法代表全月（去年7月全月17.99万吨，日均7,800吨，今年前三周日均仅3,500吨）；(3)物流瓶颈——巴西矿业物流（港口、铁路）如出现短期中断也可能导致出口节奏延迟。需继续跟踪7月全月和8月数据以判断是否为趋势性变化还是单月波动。与智利铜矿因冬季风暴减产相呼应，南美两大铜矿出口国同时出现供给侧收紧信号——这在全球铜精矿TC -146美元/干吨的背景下尤其敏感。",
      "importance": "巴西是全球前10大铜矿出口国之一（2025年出口铜矿约180万吨），主要出口至德国和中国。7月出口数据骤降是否代表趋势还是季节性波动需要更多数据验证，但在H1同比+84%之后出现-55.56%的逆转，是短期内不容忽视的供给端信号。若7月全月数据确认持续低迷，可能意味着南美铜矿出口正面临比预期更广泛的供给侧约束。",
      "language": "zh",
      "duplicate_of": null
    },
    {
      "source": "财联社 / 格隆汇",
      "title": "智利中南部冬季风暴第4天：已致多人死亡，Codelco/Antofagasta/Anglo American矿山及中部港口持续受限",
      "url": "https://new.qq.com/rain/a/20260721A09WJN00",
      "publish_time": "2026-07-21",
      "metal_tags": ["copper"],
      "primary_metal": "copper",
      "supply_demand": "supply",
      "excerpt": "7月21日，财联社报道：一场强烈的冬季风暴持续侵袭智利中部，已造成多人死亡。恶劣天气导致大型铜矿作业持续受到影响，港口船舶航行受限。Codelco、Antofagasta和Anglo American在内的多家矿企已启动安全应急预案并对部分作业作出调整。智利海事部门表示中部部分港口的船舶通行继续受到限制。此轮风暴自7月18日开始，7月21日为第4天，此前预报称风暴有望于7月19日（周日）后逐步减弱，但实际持续时间超出预期。来源：财联社。",
      "interpretation": "智利冬季风暴从7月18日延续至7月21日（第4天）且造成人员死亡，表明此次天气事件的严重性超出了初始预报（原预计周末后减弱）。第4天矿山和港口仍受限意味着：(1)铜精矿和电解铜出口物流中断时间已超过一个完整工作日周期（覆盖周日至周二），累积影响大于单日事件；(2)人员死亡意味着矿山安全审查和停工范围可能扩大——智利矿业监管机构可能要求对受影响矿区进行全面安全评估后才能复产；(3)港口船舶通行受限叠加Escondida工人罢工（7月15日起）形成智利铜出口的\"双重瓶颈\"。虽然7月18日报导已覆盖同一风暴，但7月21日的持续时间和人员伤亡是新的量化事实——它将一个\"短期天气干扰\"升级为\"持续性供给中断\"。",
      "importance": "智利占全球铜矿产量的约25%。此轮风暴从7月18日持续至21日，覆盖多个工作日，对中部矿区（Andina/El Teniente/Los Pelambres/Los Bronces）的生产和出口物流造成了超过96小时的实质性影响。每日损失铜产量估计约1,500-2,000吨（基于受影响矿山产能），4天累计损失约6,000-8,000吨铜精矿含铜——在TC -146美元/干吨的极度紧缺市场中，任何供给中断都会被市场放大定价。与7月18日首次报道不同，7月21日的\"第4天+人员死亡\"信息将事件从预警级升级为持续供给中断级。",
      "language": "zh",
      "duplicate_of": null
    }
  ],
  "search_log": {
    "part1_searched": true,
    "part1_sources_checked": [
      "Mining Stock Daily (Jul 19-21: no new episodes)",
      "Crux Investor (Jul 19-21: no new interview content)",
      "Sprott Insights / Money of Mine / Northern Miner / Mining Stock Education (Jul 19-21: 均无新内容)",
      "YouTube/Spotify/Apple Podcasts mining indexes (无合格内容)"
    ],
    "part1_result": "72h窗口（07-19至07-21，周日至周二）：0条合格访谈。主要频道周末无产出，工作日过渡阶段。",
    "part2_searched": true,
    "part2_channel": "browser_use",
    "part2_sources_checked": [
      "Playwright + Chromium headless (Python 3.13.12, storage_state from .browser_profile/x_auth.json, 52 handles)",
      "Keywords: gold, silver, copper, mining, mine, production, supply, demand"
    ],
    "part2_result": "12条原始候选，1条合格：Ivanhoe Mines Kamoa采矿率+30%。其余排除：技术分析、市场情绪、6月滞后数据、个股推荐、公司访谈推广。",
    "part3_sources_checked": [
      "MMG/五矿资源 HKEX Q2 2026生产报告 (Jul 21: 入选)",
      "Alkane Resources ASX FY26 Q4+全年季报 (Jul 21 Mining Weekly转载: 入选)",
      "巴西Secex铜矿出口7月前三周数据 (Jul 21 新华财经/北方有色网: 入选)",
      "智利冬季风暴第4天更新 (Jul 21 财联社/格隆汇: 入选)",
      "MINING.com site:mining.com copper/gold/silver (Jul 21: 无新文章；/commodity/copper/返回403)",
      "SMM有色网/Mysteel/Mysteel (Jul 21: 价格/交易数据，无供需事件)",
      "新华财经/券商报告 (Jul 21: 行情分析，无新供需信号)",
      "Escondida罢工 (Jul 15启动, Jul 21第7天: 无新增进展，排除)",
      "BHP Vicuña/Seabridge Gold KSM (已知项目进展/融资交易，排除)"
    ],
    "part3_result": "Jul 21: 4 qualified news items. (1) MMG Q2 — 铜供给品位压力+成本改善；(2) Alkane FY26 — 金供给达指引上沿+首度派息；(3) 巴西7月铜出口日均-55.56% — 与H1 +84%形成反转；(4) 智利风暴第4天 — 持续矿山港口中断+人员死亡。",
    "new_sources_discovered": [],
    "url_verification": {
      "checked": 5,
      "passed": 5,
      "failed": 0,
      "failures": [],
      "notes": [
        "Ivanhoe Mines Kamoa X帖: 核验通过 — 原帖URL确认，Ivanhoe官方账号，7月21日发布。",
        "MMG Q2报告: 核验通过 — 智通财经全文确认，HKEX公告日期7月21日。",
        "Alkane FY26: 核验通过 — Mining Weekly 7月21日报道（ASX同日公告），确认168,337oz AuEq，首次派息。",
        "巴西铜矿出口: 核验通过 — 北方有色网全文确认（新华财经Secex原始数据），7月前三周4.52万吨，日均-55.56%。",
        "智利风暴第4天: 核验通过 — 财联社/格隆汇7月21日报道，确认风暴持续、多人死亡、矿山港口受限。与07-18报道相比，第4天持续+人员死亡为新事实。"
      ]
    }
  },
  "dedup_log": {
    "part1_deduped_urls": [
      "M&M Podcast Jul 16 Michael Pento gold miners macro — 已在07-16日报排除"
    ],
    "part3_deduped_events": [
      "Escondida工人罢工（7月15日启动）— 罢工第7天无新增进展，排除",
      "BHP Vicuña RIGI获批（原始6月16日）— 已知项目进展，排除",
      "Seabridge Gold KSM $100M信贷（7月21日）— 项目融资交易，非供需事件，排除",
      "SMM洋山铜溢价$109/mt（7月21日）— 价格延续，07-20已覆盖溢价破$100核心信号，排除",
      "券商/期货公司有色分析报告（7月21日）— 行情分析无新供需事件，排除"
    ]
  }
}
