{
  "date": "2026-08-08",
  "report_time": "2026-08-09T07:17:59.6056745+08:00",
  "summary": "铜：报告日未发现可核验的新增供需信号，方向维持中性；黄金：未发现新增供需变化；白银：未发现新增供需变化。",
  "windows": {
    "part1": {
      "start": "2026-08-06T00:00:00+08:00",
      "end": "2026-08-08T23:59:59+08:00"
    },
    "part2": {
      "start": "2026-08-08T00:00:00+08:00",
      "end": "2026-08-08T23:59:59+08:00"
    },
    "part3": {
      "start": "2026-08-08T00:00:00+08:00",
      "end": "2026-08-08T23:59:59+08:00"
    }
  },
  "part1_broadcasts": [],
  "part2_x_posts": [],
  "part3_news": [],
  "search_log": {
    "part1_searched": true,
    "part1_sources_checked": [
      "按2026-08-06至2026-08-08北京时间72小时窗口检查data/conference_calendar.json、公司IR事件页、业绩电话会、网络直播和可访问回放候选。",
      "Torex Gold官方Upcoming Events确认2026年8月7日Q2业绩电话会，但页面未提供可核验的报告日回放、文字记录或新的金供需事实；其Q2生产材料发布日期早于检索窗口，未纳入。",
      "Diggers & Dealers官方节目及Hot Chili官方活动页确认论坛为2026年8月3日至5日，早于Part 1窗口；OceanaGold事件通知和Allied Gold AGM候选未提供可核验的报告日金银铜供需访谈内容，均未纳入。"
    ],
    "part1_result": "Part 1完成72小时访谈、会议、网络直播、公司演示和回放检索；未找到同时满足窗口、原始内容可访问和金银铜供需事实可核对条件的访谈信号，纳入0条。",
    "part2_searched": true,
    "part2_channel": "browser_use",
    "part2_sources_checked": [
      "使用C:/Users/Zhemin/.workbuddy/binaries/python/versions/3.13.12/python.exe、Playwright、明确Chrome路径、headless模式和项目.browser_profile/chromium-data持久化会话运行scripts/x_search.py --check-login --headless；持久化Profile启动失败后按脚本既定fallback使用.browser_profile/x_auth.json，X认证首页检查通过。",
      "运行scripts/x_search.py 2026-08-08 --headless，检索34个个人账号和18个官方账号，发现9条日期匹配原帖候选并保存至x_outputs/2026-08-08_x_raw_materials.txt；未覆盖历史原始材料。",
      "9条候选均为价格或宏观观点、投资意见、推广内容、非目标金属或缺少可核验实体供需新增事实，未纳入日报；没有用搜索摘要或截图替代原帖证据。"
    ],
    "part2_result": "Part 2通道认证通过，原始候选9条、纳入0条；没有符合实体金银铜供需事实和唯一新增事件标准的原作者帖子。",
    "part3_sources_checked": [
      "Mining.com铜分类页主路径：使用规定的Python路径、Playwright、Chromium headless、--disable-blink-features=AutomationControlled和--no-sandbox打开https://www.mining.com/commodity/copper/；HTTP 200、页面标题Copper Archives - MINING.COM、DOM提取报告日文章0篇。",
      "Mining.com金分类页和银分类页由同一隔离Playwright会话检查，均返回CloudFront HTTP 403错误页，未获得合格候选；未使用sitemap、Wayback Machine或RSS feed。",
      "Google site:mining.com gold August 8 2026与gold Aug 8 2026两组查询合计6个结果，均为历史、SEO或非报告日内容；Google site:mining.com silver August 8 2026与silver Aug 8 2026两组查询合计5个结果，均为历史、SEO或非报告日内容；搜索摘要仅用于发现。",
      "隔离Playwright打开SMM库存关键词页https://news.smm.cn/keywords/%E5%BA%93%E5%AD%98，页面可访问但最新相关条目为2026-08-07；包含的SMM铜精矿周评和库存页面均早于报告日，未纳入2026-08-08日报。",
      "补充中英文新闻检索未发现报告日可核验的目标金属供需事实；价格复述、宏观评论、非目标金属事件和报告窗口外文章均按规则排除。"
    ],
    "part3_result": "完成2026-08-08全天新闻检索、Mining.com铜强制分类页主路径、金银分类页检查、Google site:备用路径和SMM动态页面检查；铜分类页0篇，最终纳入0条。",
    "mining_com_source_note": "Mining.com铜分类页主路径由规定的Playwright Chromium headless成功抓取，HTTP 200、报告日文章数0；金/银分类页同一隔离会话返回CloudFront 403，因此未获得金银候选。Google site:搜索仅作候选发现且未产生合格报告日文章；无候选需要文章正文回退核验。",
    "url_verification": {
      "checked": 10,
      "passed": 8,
      "failed": 2,
      "failures": [
        {
          "url": "https://www.mining.com/commodity/gold/",
          "reason": "隔离Playwright会话返回CloudFront HTTP 403错误页，未获得报告日候选。"
        },
        {
          "url": "https://www.mining.com/commodity/silver/",
          "reason": "隔离Playwright会话返回CloudFront HTTP 403错误页，未获得报告日候选。"
        }
      ],
      "notes": "无入选信号，因此没有需要作为日报证据的入选URL；铜分类页主路径、Part 1事件页、SMM动态页和X搜索通道均已按可访问性或候选状态记录。"
    },
    "new_sources_discovered": []
  },
  "dedup_log": {
    "part1_deduped_urls": [],
    "part2_deduped_urls": [
      "9条X候选均因缺少实体金银铜供需新增事实或属于价格、宏观、投资观点和非目标金属内容排除，未与Part 1或Part 3重复展示。"
    ],
    "part3_deduped_events": [
      "SMM铜精矿周评和库存页面发布日期为2026-08-07，早于报告日并已在前一日报告或TC数据范围内，不重复展示。",
      "Google site:结果中的历史文章、分类页、SEO页面和报告窗口外内容不构成报告日事件；Mining.com金银分类页403未产生可去重候选。",
      "报告日未发现可核验的新增目标金属供需事件，因此没有跨来源或跨栏目重复的入选信号。"
    ],
    "notes": "本日报无入选信号；primary_metal、metal_tags和importance逐条复核不适用。"
  }
}
